{
  "content_fingerprint": "sha256:f10b664538432de837d2e3f95a9afa9d65b6d1f750324247331bc40e33de5b5e",
  "focused_element": {
    "automation_id": "editor",
    "class_name": "MonacoEditor",
    "control_type": "Edit",
    "is_editable": true,
    "is_password": false,
    "name": "Editor",
    "text": "OPENAI_API_KEY=[REDACTED:api_key]\nGITHUB_TOKEN=[REDACTED:github_token]\nSLACK_TOKEN=[REDACTED:slack_token]\nJWT=[REDACTED:jwt]\nPRIVATE_KEY=[REDACTED:private_key]",
    "text_length": 159,
    "value": null,
    "value_length": 0
  },
  "platform": "windows",
  "redactions": [
    {
      "count": 2,
      "type": "api_key"
    },
    {
      "count": 2,
      "type": "github_token"
    },
    {
      "count": 2,
      "type": "jwt"
    },
    {
      "count": 2,
      "type": "private_key"
    },
    {
      "count": 2,
      "type": "slack_token"
    }
  ],
  "schema_version": 1,
  "screenshot": null,
  "source": "fixture",
  "timestamp": "2026-04-25T12:11:00+08:00",
  "trigger": {
    "event_type": "capture_once",
    "source": "manual"
  },
  "uia_tree_hash": "sha256:6cc97962c94fa17f4e008d2fe87e0cbba8fe4f2e6f05866809d975a4c95ab6db",
  "untrusted_observed_content": true,
  "url": null,
  "visible_text": "OPENAI_API_KEY=[REDACTED:api_key]\nGITHUB_TOKEN=[REDACTED:github_token]\nSLACK_TOKEN=[REDACTED:slack_token]\nJWT=[REDACTED:jwt]\nPRIVATE_KEY=[REDACTED:private_key]",
  "window_meta": {
    "app_name": "Visual Studio Code",
    "bounds": [
      50,
      50,
      1680,
      950
    ],
    "elevated": false,
    "exe_path": "C:\\Users\\me\\AppData\\Local\\Programs\\Microsoft VS Code\\Code.exe",
    "hwnd": "0x0000000000BAD002",
    "pid": 7340,
    "process_name": "Code.exe",
    "title": ".env - WinChronicle - Visual Studio Code"
  }
}
